{
  "schema_name": "software-satellite-agent-session-bundle",
  "schema_version": 1,
  "agent_label": "manual",
  "session_started_at_utc": "2026-05-12T04:00:00Z",
  "session_finished_at_utc": "2026-05-12T04:05:00Z",
  "task": {
    "title": "Manual PR bundle",
    "goal": "Capture local PR diff, human review note, and CI log."
  },
  "artifacts": [
    {
      "kind": "diff",
      "path": "examples/agent_session_bundles/files/manual-pr.diff"
    },
    {
      "kind": "review_note",
      "path": "examples/agent_session_bundles/files/manual-review.md"
    },
    {
      "kind": "ci_log",
      "path": "examples/agent_session_bundles/files/manual-ci.txt"
    }
  ],
  "declared_claims": [],
  "privacy": {
    "contains_private_code": true,
    "contains_user_text": true,
    "export_allowed": false
  }
}
