{
  "schema_name": "software-satellite-agent-session-bundle",
  "schema_version": 1,
  "agent_label": "aider",
  "session_started_at_utc": "2026-05-12T03:00:00Z",
  "session_finished_at_utc": "2026-05-12T03:12:00Z",
  "task": {
    "title": "Cache key patch",
    "goal": "Capture a local patch where the transcript claim conflicts with a failing test log."
  },
  "artifacts": [
    {
      "kind": "diff",
      "path": "examples/agent_session_bundles/files/aider.diff"
    },
    {
      "kind": "transcript",
      "path": "examples/agent_session_bundles/files/aider-transcript.md"
    },
    {
      "kind": "test_log",
      "path": "examples/agent_session_bundles/files/aider-test.txt"
    }
  ],
  "declared_claims": [],
  "privacy": {
    "contains_private_code": true,
    "contains_user_text": true,
    "export_allowed": false
  }
}
